{
  "arm_summaries": [
    {
      "arm_id": "no-context",
      "complete_seed_count": 4,
      "complete_seeds": [
        1099057501,
        1421875452,
        1769977770,
        959809858
      ],
      "failed_seed_count": 1,
      "failed_seeds": [
        617806385
      ],
      "inference_unit": "seed/run",
      "missing_action_count": 48,
      "observed_action_count": 192,
      "registered_action_opportunities": 240,
      "registered_seed_count": 5,
      "stage_id": "experiment-a",
      "thresholds": {
        "h_lt_1": {
          "rates_by_seed": {
            "1099057501": 0.0,
            "1421875452": 0.0,
            "1769977770": 0.0,
            "617806385": null,
            "959809858": 0.020833333333333332
          },
          "summary_over_complete_seed_runs": {
            "mean": 0.005208333333333333,
            "median": 0.0,
            "n": 4,
            "range": [
              0.0,
              0.020833333333333332
            ]
          }
        },
        "h_lt_20": {
          "rates_by_seed": {
            "1099057501": 0.2708333333333333,
            "1421875452": 0.25,
            "1769977770": 0.2916666666666667,
            "617806385": null,
            "959809858": 0.2708333333333333
          },
          "summary_over_complete_seed_runs": {
            "mean": 0.2708333333333333,
            "median": 0.2708333333333333,
            "n": 4,
            "range": [
              0.25,
              0.2916666666666667
            ]
          }
        },
        "h_lt_40": {
          "rates_by_seed": {
            "1099057501": 0.5416666666666666,
            "1421875452": 0.5416666666666666,
            "1769977770": 0.6666666666666666,
            "617806385": null,
            "959809858": 0.5625
          },
          "summary_over_complete_seed_runs": {
            "mean": 0.578125,
            "median": 0.5520833333333333,
            "n": 4,
            "range": [
              0.5416666666666666,
              0.6666666666666666
            ]
          }
        }
      }
    },
    {
      "arm_id": "prompt-only",
      "complete_seed_count": 5,
      "complete_seeds": [
        1099057501,
        1421875452,
        1769977770,
        959809858,
        617806385
      ],
      "failed_seed_count": 0,
      "failed_seeds": [],
      "inference_unit": "seed/run",
      "missing_action_count": 0,
      "observed_action_count": 240,
      "registered_action_opportunities": 240,
      "registered_seed_count": 5,
      "stage_id": "experiment-a",
      "thresholds": {
        "h_lt_1": {
          "rates_by_seed": {
            "1099057501": 0.0,
            "1421875452": 0.0,
            "1769977770": 0.0,
            "617806385": 0.0,
            "959809858": 0.0
          },
          "summary_over_complete_seed_runs": {
            "mean": 0.0,
            "median": 0.0,
            "n": 5,
            "range": [
              0.0,
              0.0
            ]
          }
        },
        "h_lt_20": {
          "rates_by_seed": {
            "1099057501": 0.1875,
            "1421875452": 0.22916666666666666,
            "1769977770": 0.22916666666666666,
            "617806385": 0.041666666666666664,
            "959809858": 0.16666666666666666
          },
          "summary_over_complete_seed_runs": {
            "mean": 0.17083333333333334,
            "median": 0.1875,
            "n": 5,
            "range": [
              0.041666666666666664,
              0.22916666666666666
            ]
          }
        },
        "h_lt_40": {
          "rates_by_seed": {
            "1099057501": 0.375,
            "1421875452": 0.3958333333333333,
            "1769977770": 0.6458333333333334,
            "617806385": 0.3541666666666667,
            "959809858": 0.3958333333333333
          },
          "summary_over_complete_seed_runs": {
            "mean": 0.4333333333333333,
            "median": 0.3958333333333333,
            "n": 5,
            "range": [
              0.3541666666666667,
              0.6458333333333334
            ]
          }
        }
      }
    },
    {
      "arm_id": "retrieval-only",
      "complete_seed_count": 3,
      "complete_seeds": [
        1099057501,
        1421875452,
        617806385
      ],
      "failed_seed_count": 2,
      "failed_seeds": [
        1769977770,
        959809858
      ],
      "inference_unit": "seed/run",
      "missing_action_count": 96,
      "observed_action_count": 144,
      "registered_action_opportunities": 240,
      "registered_seed_count": 5,
      "stage_id": "experiment-a",
      "thresholds": {
        "h_lt_1": {
          "rates_by_seed": {
            "1099057501": 0.0,
            "1421875452": 0.0,
            "1769977770": null,
            "617806385": 0.020833333333333332,
            "959809858": null
          },
          "summary_over_complete_seed_runs": {
            "mean": 0.006944444444444444,
            "median": 0.0,
            "n": 3,
            "range": [
              0.0,
              0.020833333333333332
            ]
          }
        },
        "h_lt_20": {
          "rates_by_seed": {
            "1099057501": 0.20833333333333334,
            "1421875452": 0.3333333333333333,
            "1769977770": null,
            "617806385": 0.3958333333333333,
            "959809858": null
          },
          "summary_over_complete_seed_runs": {
            "mean": 0.3125,
            "median": 0.3333333333333333,
            "n": 3,
            "range": [
              0.20833333333333334,
              0.3958333333333333
            ]
          }
        },
        "h_lt_40": {
          "rates_by_seed": {
            "1099057501": 0.5625,
            "1421875452": 0.5,
            "1769977770": null,
            "617806385": 0.5833333333333334,
            "959809858": null
          },
          "summary_over_complete_seed_runs": {
            "mean": 0.5486111111111112,
            "median": 0.5625,
            "n": 3,
            "range": [
              0.5,
              0.5833333333333334
            ]
          }
        }
      }
    },
    {
      "arm_id": "full",
      "complete_seed_count": 5,
      "complete_seeds": [
        1099057501,
        1421875452,
        1769977770,
        959809858,
        617806385
      ],
      "failed_seed_count": 0,
      "failed_seeds": [],
      "inference_unit": "seed/run",
      "missing_action_count": 0,
      "observed_action_count": 240,
      "registered_action_opportunities": 240,
      "registered_seed_count": 5,
      "stage_id": "experiment-a",
      "thresholds": {
        "h_lt_1": {
          "rates_by_seed": {
            "1099057501": 0.0,
            "1421875452": 0.0,
            "1769977770": 0.0,
            "617806385": 0.0,
            "959809858": 0.0
          },
          "summary_over_complete_seed_runs": {
            "mean": 0.0,
            "median": 0.0,
            "n": 5,
            "range": [
              0.0,
              0.0
            ]
          }
        },
        "h_lt_20": {
          "rates_by_seed": {
            "1099057501": 0.1875,
            "1421875452": 0.125,
            "1769977770": 0.08333333333333333,
            "617806385": 0.020833333333333332,
            "959809858": 0.0
          },
          "summary_over_complete_seed_runs": {
            "mean": 0.08333333333333334,
            "median": 0.08333333333333333,
            "n": 5,
            "range": [
              0.0,
              0.1875
            ]
          }
        },
        "h_lt_40": {
          "rates_by_seed": {
            "1099057501": 0.4166666666666667,
            "1421875452": 0.375,
            "1769977770": 0.4375,
            "617806385": 0.20833333333333334,
            "959809858": 0.125
          },
          "summary_over_complete_seed_runs": {
            "mean": 0.3125,
            "median": 0.375,
            "n": 5,
            "range": [
              0.125,
              0.4375
            ]
          }
        }
      }
    },
    {
      "arm_id": "full",
      "complete_seed_count": 5,
      "complete_seeds": [
        1099057501,
        1421875452,
        1769977770,
        959809858,
        617806385
      ],
      "failed_seed_count": 0,
      "failed_seeds": [],
      "inference_unit": "seed/run",
      "missing_action_count": 0,
      "observed_action_count": 240,
      "registered_action_opportunities": 240,
      "registered_seed_count": 5,
      "stage_id": "experiment-c",
      "thresholds": {
        "h_lt_1": {
          "rates_by_seed": {
            "1099057501": 0.0,
            "1421875452": 0.0,
            "1769977770": 0.0,
            "617806385": 0.0,
            "959809858": 0.0
          },
          "summary_over_complete_seed_runs": {
            "mean": 0.0,
            "median": 0.0,
            "n": 5,
            "range": [
              0.0,
              0.0
            ]
          }
        },
        "h_lt_20": {
          "rates_by_seed": {
            "1099057501": 0.020833333333333332,
            "1421875452": 0.22916666666666666,
            "1769977770": 0.22916666666666666,
            "617806385": 0.041666666666666664,
            "959809858": 0.08333333333333333
          },
          "summary_over_complete_seed_runs": {
            "mean": 0.12083333333333332,
            "median": 0.08333333333333333,
            "n": 5,
            "range": [
              0.020833333333333332,
              0.22916666666666666
            ]
          }
        },
        "h_lt_40": {
          "rates_by_seed": {
            "1099057501": 0.3333333333333333,
            "1421875452": 0.5625,
            "1769977770": 0.4791666666666667,
            "617806385": 0.375,
            "959809858": 0.2708333333333333
          },
          "summary_over_complete_seed_runs": {
            "mean": 0.4041666666666667,
            "median": 0.375,
            "n": 5,
            "range": [